topic,subtopic,question,optionA,optionB,optionC,optionD,correctAnswer,difficulty,explanation,tags,tips,correction
"Blockchain","Konsens","Was ist Proof of Work?","Arbeitsnachweis","Konsensmechanismus durch Rechenleistung","Verschlüsselung","Signatur","B","2","PoW sichert Blockchain durch rechenintensive Aufgaben.","blockchain,pow,konsens","Bitcoin nutzt PoW","Energieintensiv"
"Blockchain","Smart Contracts","Was sind Smart Contracts?","Juristische Verträge","Selbstausführende Programme","E-Mail-Verträge","PDF-Dokumente","B","2","Smart Contracts sind Programme die automatisch Bedingungen ausführen.","blockchain,smart-contract,ethereum","If-Then-Logik auf Blockchain","Ethereum primäre Plattform"
"Blockchain","Mining","Was macht ein Miner?","Gräbt Münzen","Validiert Transaktionen","Programmiert","Designed","B","2","Miner validieren Transaktionen und erstellen neue Blöcke.","blockchain,mining,krypto","Erhält Block-Reward","Sichert das Netzwerk"
"Blockchain","DeFi","Was bedeutet DeFi?","Definierte Finanzen","Decentralized Finance","Deutsche Finanzen","Default Finance","B","2","DeFi sind Finanzdienstleistungen auf Blockchain ohne Intermediäre.","blockchain,defi,finance","Lending, Trading, Staking","Smart Contracts statt Banken"
"IoT","Protokolle","Welches Protokoll ist typisch für IoT?","HTTP","MQTT","FTP","SMTP","B","2","MQTT ist leichtgewichtiges Publish-Subscribe Protokoll für IoT.","iot,mqtt,protokoll","Geringer Bandbreitenbedarf","Ideal für Sensordaten"
"IoT","Edge Computing","Was ist Edge Computing?","Cloud Computing","Datenverarbeitung am Netzwerkrand","Zentrale Verarbeitung","Backup-Strategie","B","2","Edge Computing verarbeitet Daten nahe der Quelle statt in Cloud.","iot,edge,computing","Reduziert Latenz","Entlastet Netzwerk"
"IoT","Sicherheit","Was ist eine große IoT-Sicherheitsherausforderung?","Zu wenig Geräte","Schwache Default-Passwörter","Zu viel Speicher","Zu schnelle Prozessoren","B","1","Viele IoT-Geräte haben unsichere Standardkonfigurationen.","iot,sicherheit,passwort","Mirai-Botnetz als Beispiel","Updates oft vernachlässigt"
"IoT","Standards","Was ist Zigbee?","Programmiersprache","Drahtloser IoT-Standard","Datenbank","Betriebssystem","B","2","Zigbee ist energieeffizienter Funkstandard für Smart Home.","iot,zigbee,wireless","2.4 GHz Band","Mesh-Netzwerk-fähig"
"IoT","Sensoren","Was misst ein Gyroskop?","Temperatur","Drehbewegung","Druck","Feuchtigkeit","B","1","Gyroskop misst Winkelgeschwindigkeit und Orientierung.","iot,sensor,gyroskop","In Smartphones und Drohnen","Stabilisierung und Navigation"
"Machine Learning","Typen","Was ist Supervised Learning?","Lernen ohne Daten","Lernen mit gelabelten Daten","Lernen ohne Labels","Verstärkungslernen","B","2","Supervised Learning trainiert mit Input-Output-Paaren.","ml,supervised,learning","Klassifikation und Regression","Braucht annotierte Trainingsdaten"
"Machine Learning","Algorithmen","Was ist ein Decision Tree?","Datenbankstruktur","Entscheidungsbaum-Algorithmus","Netzwerkprotokoll","Verschlüsselung","B","1","Decision Trees treffen Entscheidungen durch Baumstruktur.","ml,decision-tree,algorithmus","Leicht interpretierbar","Neigt zu Overfitting"
"Machine Learning","Neural Networks","Was ist ein Neuron in einem Neural Network?","Gehirnzelle","Recheneinheit","Datenbank","Variable","B","2","Künstliches Neuron berechnet gewichtete Summe mit Aktivierungsfunktion.","ml,neural-network,neuron","Inspiriert von Biologie","Basis von Deep Learning"
"Machine Learning","Evaluation","Was ist Overfitting?","Zu wenig Training","Modell zu spezifisch auf Trainingsdaten","Zu wenig Daten","Modell zu einfach","B","2","Overfitting: Modell lernt Rauschen statt Muster.","ml,overfitting,evaluation","Schlechte Generalisierung","Regularisierung als Lösung"
"Machine Learning","Deep Learning","Was ist ein CNN?","Content Network","Convolutional Neural Network","Computer Network","Crypto Network","B","2","CNNs sind spezialisiert auf Bilderkennung durch Faltungsschichten.","ml,cnn,deep-learning","Erkennt lokale Muster","ImageNet-Revolution"